{
  "$schema": "https://json-schema.org/draft/2020-12/schema",
  "title": "OpenAPI path fragment",
  "type": "object",
  "required": ["openapi", "info", "paths"],
  "properties": {
    "openapi": { "type": "string", "pattern": "^3\\.1\\.\\d+$" },
    "info": {
      "type": "object",
      "required": ["title", "version"],
      "properties": {
        "title": { "type": "string", "minLength": 1 },
        "version": { "type": "string", "minLength": 1 }
      },
      "additionalProperties": false
    },
    "paths": {
      "type": "object",
      "minProperties": 1,
      "patternProperties": {
        "^/": { "$ref": "#/$defs/pathItem" }
      },
      "additionalProperties": false
    },
    "components": {
      "type": "object",
      "properties": {
        "schemas": {
          "type": "object",
          "additionalProperties": { "$ref": "#/$defs/schemaObject" }
        }
      }
    }
  },
  "$defs": {
    "pathItem": {
      "type": "object",
      "properties": {
        "get": { "$ref": "#/$defs/operation" },
        "post": { "$ref": "#/$defs/operation" },
        "parameters": {
          "type": "array",
          "items": { "$ref": "#/$defs/parameter" }
        }
      },
      "additionalProperties": false
    },
    "operation": {
      "type": "object",
      "required": ["operationId", "responses"],
      "properties": {
        "operationId": { "type": "string", "minLength": 1 },
        "tags": { "type": "array", "items": { "type": "string" } },
        "parameters": { "type": "array", "items": { "$ref": "#/$defs/parameter" } },
        "responses": {
          "type": "object",
          "patternProperties": {
            "^[1-5][0-9][0-9]$": { "$ref": "#/$defs/response" }
          },
          "additionalProperties": false
        }
      },
      "additionalProperties": false
    },
    "parameter": {
      "type": "object",
      "required": ["name", "in", "schema"],
      "properties": {
        "name": { "type": "string" },
        "in": { "enum": ["query", "header", "path", "cookie"] },
        "required": { "type": "boolean" },
        "schema": { "$ref": "#/$defs/schemaObject" }
      },
      "additionalProperties": false
    },
    "response": {
      "type": "object",
      "required": ["description"],
      "properties": {
        "description": { "type": "string" },
        "content": { "type": "object" }
      },
      "additionalProperties": false
    },
    "schemaObject": {
      "type": "object",
      "properties": {
        "type": { "enum": ["string", "number", "integer", "boolean", "array", "object"] },
        "format": { "type": "string" },
        "items": { "$ref": "#/$defs/schemaObject" },
        "properties": {
          "type": "object",
          "additionalProperties": { "$ref": "#/$defs/schemaObject" }
        },
        "required": { "type": "array", "items": { "type": "string" } }
      },
      "additionalProperties": true
    }
  }
}
